{
  "SchemaVersion": "1.3",
  "Version": "1.0",
  "AksEdgeProduct": "AKS Edge Essentials - K3s",
  "AksEdgeProductUrl": "https://download.microsoft.com/download/828d40d9-2ca9-442e-b492-0fbcdbeb7ad6/AksEdge-K3s-1.33.5-1.12.269.0.msi",
  "InstallOptions": {
    "InstallPath": "",
    "VhdxPath": ""
  },
  "VSwitch": {
    "Name": "",
    "AdapterName": ""
  },
  "Azure": {
    "SubscriptionName": "",
    "SubscriptionId": "<subscription-id>",
    "TenantId": "<tenant-id>",
    "ResourceGroupName": "<resourcegroup-name>",
    "ServicePrincipalName": "",
    "Location": "<location>",
    "CustomLocationOID": "<customlocation-oid>",
    "EnableWorkloadIdentity": true,
    "GatewayResourceId": "",
    "Auth": {
      "ServicePrincipalId": "",
      "Password": ""
    }
  },
  "AksEdgeConfigFile": "aio-aksedge-config.json"
}